{
  "region_code": "1103",
  "region_name": "Краснодарский край",
  "plan_tr": {
    "2023": 3.37,
    "2024": 3.17,
    "2025": 3.45,
    "2026": 3.36,
    "2027": 3.27,
    "2028": 3.04,
    "2029": 2.68,
    "2030": 2.36
  },
  "source": "Паспорт НП БДД, Excel: plans_tr.xlsx",
  "loaded_at": "2026-07-31"
}