{
  "region_code": "1122",
  "region_name": "Нижегородская область",
  "plan_tr": {
    "2023": 1.99,
    "2024": 1.87,
    "2025": 1.79,
    "2026": 1.62,
    "2027": 1.58,
    "2028": 1.54,
    "2029": 1.43,
    "2030": 1.42
  },
  "source": "Паспорт НП БДД, Excel: plans_tr.xlsx",
  "loaded_at": "2026-07-31"
}