{
  "region_code": "1182",
  "region_name": "Республика Дагестан",
  "plan_tr": {
    "2023": 3.74,
    "2024": 3.52,
    "2025": 3.87,
    "2026": 3.68,
    "2027": 3.52,
    "2028": 3.21,
    "2029": 2.94,
    "2030": 2.66
  },
  "source": "Паспорт НП БДД, Excel: plans_tr.xlsx",
  "loaded_at": "2026-07-31"
}