{
  "region_code": "1160",
  "region_name": "Ростовская область",
  "plan_tr": {
    "2023": 2.36,
    "2024": 2.22,
    "2025": 2.78,
    "2026": 2.67,
    "2027": 2.52,
    "2028": 2.35,
    "2029": 2.14,
    "2030": 1.91
  },
  "source": "Паспорт НП БДД, Excel: plans_tr.xlsx",
  "loaded_at": "2026-07-31"
}