{
  "region_code": "1119",
  "region_name": "Вологодская область",
  "plan_tr": {
    "2023": 1.75,
    "2024": 1.66,
    "2025": 1.93,
    "2026": 1.82,
    "2027": 1.7,
    "2028": 1.59,
    "2029": 1.46,
    "2030": 1.37
  },
  "source": "Паспорт НП БДД, Excel: plans_tr.xlsx",
  "loaded_at": "2026-07-31"
}