{
  "region_code": "1147",
  "region_name": "Мурманская область",
  "plan_tr": {
    "2023": 1.42,
    "2024": 1.37,
    "2025": 1.87,
    "2026": 1.75,
    "2027": 1.62,
    "2028": 1.53,
    "2029": 1.43,
    "2030": 1.33
  },
  "source": "Паспорт НП БДД, Excel: plans_tr.xlsx",
  "loaded_at": "2026-07-31"
}