{
  "region_code": "1146",
  "region_name": "Московская область",
  "plan_tr": {
    "2023": 2.31,
    "2024": 2.18,
    "2025": 1.88,
    "2026": 1.77,
    "2027": 1.65,
    "2028": 1.54,
    "2029": 1.43,
    "2030": 1.31
  },
  "source": "Паспорт НП БДД, Excel: plans_tr.xlsx",
  "loaded_at": "2026-07-31"
}