{
  "region_code": "1141",
  "region_name": "Ленинградская область",
  "plan_tr": {
    "2023": 3.88,
    "2024": 3.66,
    "2025": 3.51,
    "2026": 3.31,
    "2027": 3.1,
    "2028": 2.9,
    "2029": 2.7,
    "2030": 2.48
  },
  "source": "Паспорт НП БДД, Excel: plans_tr.xlsx",
  "loaded_at": "2026-07-31"
}