{
  "region_code": "1106",
  "region_name": "г. Севастополь",
  "plan_tr": {
    "2023": 2.03,
    "2024": 1.99,
    "2025": 1.2,
    "2026": 1.14,
    "2027": 1.08,
    "2028": 1.03,
    "2029": 0.97,
    "2030": 0.91
  },
  "source": "Паспорт НП БДД, Excel: plans_tr.xlsx",
  "loaded_at": "2026-07-31"
}