{
  "region_code": "1133",
  "region_name": "Кировская область",
  "plan_tr": {
    "2023": 2.53,
    "2024": 2.35,
    "2025": 2.96,
    "2026": 2.86,
    "2027": 2.73,
    "2028": 2.56,
    "2029": 2.35,
    "2030": 2.09
  },
  "source": "Паспорт НП БДД, Excel: plans_tr.xlsx",
  "loaded_at": "2026-07-31"
}